,Title,Earliest Semester Takeable,Prereqs,Coreqs,Exclusions,Notes,Semesters Available,Raw Prereqs
APM236H1,Applications of Linear Programming,"(1, 'Winter')!!",,,,,"Fall!!,Winter!!",MAT221H1/ MAT223H1/ MAT223H5/ MATA22H3/ MATA23H3/ MAT240H1/ MAT240H5
APM306Y1,Mathematics and Law,"(2, 'Fall-Winter')",,,,,Fall-Winter,"MAT133Y1/ MAT135H1/ MAT135H5/ MAT136H1/ MAT136H5/ MAT137Y1/ MAT137Y5/ (MAT137H5, MAT139H5)/ MAT157Y1/ MAT157Y5/ (MAT157H5, MAT159H5), MAT221H1/ MAT223H1/ MAT240H1"
APM346H1,Partial Differential Equations,"(3, 'Fall')!!",(MAT244H1/MAT267H1),,MAT351Y1,,"Fall!!,Winter!!","MAT235Y1/ MAT235Y5/ (MAT232H5, MAT236H5)/ (MATB41H3, MATB42H3)/ MAT237Y1/ MAT237Y5/ MAT257Y1, (MAT244H1/ MATB44H3/ MAT244H5/ MAT267H1)"
APM348H1,Mathematical Modelling,"(2, 'Winter')!!",MAT244H1;(STA237H1/STA247H1(unaccounted)/STA257H1/MAT377H1),,MAT482H1,,Winter!!,"MAT244H1/MAT267H1, MAT224H1/MAT247H1, STA237H1/STA247H1/STA257H1/MAT377H1"
APM421H1,Mathematical Foundations of Quantum Mechanics and Quantum Information Theory,"(4, 'Fall')",(MAT337H1)/MAT357H1,,,,Fall,"(MAT224H1/MAT247H1, MAT337H1)/ MAT357H1"
APM426H1,General Relativity,"(3, 'Winter')",MAT363H1,,,,Winter,MAT363H1/MAT367H1
APM441H1,Asymptotic and Perturbation Methods,"(4, 'Fall')",(APM346H1/MAT351Y1);(MAT334H1/MAT354H1),,,,Fall,"APM346H1/MAT351Y1, MAT334H1/MAT354H1"
APM446H1,Applied Nonlinear Equations,"(3, 'Winter')!!",APM346H1,,,,Winter!!,APM346H1/MAT351Y1
APM461H1,Combinatorial Methods,"(2, 'Winter')!!",MAT301H1,,,,Winter!!,"MAT224H1/ MAT247H1, MAT137Y1/ MAT137Y5/ (MAT137H5, MAT139H5)/ MAT157Y1/ MAT157Y5/ (MAT157H5, MAT159H5), MAT301H1/ MAT347Y1"
APM462H1,Nonlinear Optimization,"(3, 'Fall')!!",,,,,"Fall!!,Winter!!","(MAT223H1,MAT224H1) /MAT247H1, MAT235Y1/MAT237Y1/MAT257Y1"
APM466H1,Mathematical Theory of Finance,"(3, 'Winter')!!",APM346H1;STA347H1,STA457H1,,,Winter!!,"APM346H1, STA347H1"
APM496H1,Independent Readings in Applied Mathematics,"(1, 'Winter')",,,,Note: Need undergrad chair permission,"Fall,Winter",minimum GPA 3.5 for APM and MAT courses. Permission of the Associate Chair for Undergraduate Studies and of the prospective supervisor
CSC108H1,Introduction to Computer Programming,"(1, 'Winter')",,,"CSC110Y1,CSC111H1,CSC120H1,CSC121H1,CSC148H1",,"Fall!!,Winter",
CSC110Y1,Foundations of Computer Science I,"(0, 'Fall')!!",,,"CSC108H1,CSC148H1,CSC165H1",,Fall!!,
CSC111H1,Foundations of Computer Science II,"(1, 'Winter')!!",,,"CSC108H1,CSC148H1,CSC165H1",,Winter!!,CSC110Y1 (70% or higher)
CSC148H1,Introduction to Computer Science,"(2, 'Fall')!!",CSC108H1,,"CSC111H1,CSC207H1",(equivalent programming experience),"Fall!!,Winter!!",CSC108H1/ (equivalent programming experience)
CSC165H1,Mathematical Expression and Reasoning for Computer Science,"(1, 'Winter')!!",,CSC108H1/CSC120H1(unaccounted),"CSC111H1,CSC236H1,CSC240H1",(equivalent programming experience),Winter!!,
CSC194H1,Impactful Video Game Design,"(2, 'Fall')!!",,,,,Fall!!,
CSC196H1,Great Ideas in Computing,"(1, 'Winter')!!",,,,,Winter!!,
CSC199H1,"Intelligence, Artificial and Human","(2, 'Fall')!!",,,SMC199H1,,Fall!!,
CSC207H1,Software Design,"(2, 'Fall')",,,,,Fall,60% or higher in CSC148H1/ 60% or higher in CSC111H1
CSC209H1,Software Tools and Systems Programming,"(2, 'Winter')",CSC207H1,,"CSC372H1,CSC369H1,CSC469H1",,"Fall!!,Winter",CSC207H1/ CSC207H5/ CSCB07H3
CSC236H1,Introduction to the Theory of Computation,"(2, 'Fall')!!",,,CSC240H1,,Fall!!,"(60% or higher in CSC148H1, 60% or higher in CSC165H1) / (60% or higher in CSC111H1)"
CSC240H1,Enriched Introduction to the Theory of Computation,"(1, 'Winter')!!",,MAT137Y1,"CSC236H1,CSC263H1,CSC265H1","Uncleanable string: ""CSC110Y1 (with a minimum mark of at least 70%) / CSC165H1 (with a minimum mark of at least 85%) / students with a strong mathematical background who have not completed CSC110Y1 or CSC165H1 may enrol in CSC240H1 as an enriched alternative to CSC165H1""Uncleanable string: ""Corequisite: CSC111H1/ CSC148H1; MAT137Y1/ MAT157Y1. MAT135H1 and MAT136H1 do not provide appropriate preparation for CSC240H1. Students with programming experience equivalent to CSC111H1/ CSC148H1 or who have completed math courses equivalent to MAT137Y1/ MAT157Y may apply for a corequisite waiver.""",Winter!!,CSC110Y1 (with a minimum mark of at least 70%) / CSC165H1 (with a minimum mark of at least 85%) / students with a strong mathematical background who have not completed CSC110Y1 or CSC165H1 may enrol in CSC240H1 as an enriched alternative to CSC165H1
CSC258H1,Computer Organization,"(2, 'Fall')",,,,,"Fall,Winter!!","(60% or higher in (CSC148H1/ CSC148H5/ CSCA48H3), 60% or higher in (CSC165H1/ CSC240H1/ MAT102H5/ MATA67H3/ CSCA67H3))/ 60% or higher in CSC111H1"
CSC263H1,Data Structures and Analysis,"(2, 'Winter')!!",(STA237H1/STA247H1(unaccounted)/STA257H1/ECE302H1(unaccounted)/STA286H1(unaccounted)/CHE223H1(unaccounted)/CME263H1(unaccounted)/MIE231H1(unaccounted)/MIE236H1(unaccounted)/MSE238H1(unaccounted)/STA286H1(unaccounted)),,CSC265H1,,"Fall,Winter!!",CSC236H1/ ​CSC240H1/ CSC236H5/ CSCB36H3/ APS105H1/ APS106H1/ ESC180H1; STA237H1/ STA247H1/ ​STA255H1/ ​STA257H1/ STAB57H3/ STAB52H3/ ECE302H1/ STA286H1/ CHE223H1/ CME263H1/ MIE231H1/ MIE236H1/ MSE238H1/ STA286H1
CSC265H1,Enriched Data Structures and Analysis,"(2, 'Fall')",,,CSC263H1,"Uncleanable string: ""CSC240H1 (with a minimum mark of 70%)/ (CSC236H1 (with a minimum mark of 85%), MAT377H1/ STA237H1/ STA247H1/ STA255H1/ STA257H1). Notes: Students who have completed CSC240H1 must enrol in MAT377H1/ STA237H1/ STA247H1/ STA255H1/ STA257H1 concurrently with CSC265H1, if they have not already completed one of those courses. Students who have completed additional 200- or 300-level Mathematics courses may submit a prerequisite waiver request for permission to complete the statistics requirement as a co-requisite or to consider other courses as appropriate preparation for CSC265H1.""",Fall,"CSC240H1 (with a minimum mark of 70%)/ (CSC236H1 (with a minimum mark of 85%), MAT377H1/ STA237H1/ STA247H1/ STA255H1/ STA257H1). Notes: Students who have completed CSC240H1 must enrol in MAT377H1/ STA237H1/ STA247H1/ STA255H1/ STA257H1 concurrently with CSC265H1, if they have not already completed one of those courses. Students who have completed additional 200- or 300-level Mathematics courses may submit a prerequisite waiver request for permission to complete the statistics requirement as a co-requisite or to consider other courses as appropriate preparation for CSC265H1."
CSC299H1,Research Opportunity Program,"(2, 'Fall')",,,,,Fall,
CSC299Y1,Research Opportunity Program,"(2, 'Fall-Winter')",,,,,Fall-Winter,
CSC300H1,Computers and Society,"(1, 'Winter')!!",,,,Prereq: ,"Fall!!,Winter!!",0.5 credit in CSC
CSC301H1,Introduction to Software Engineering,"(3, 'Fall')!!",CSC209H1;(CSC263H1/CSC265H1),,,,"Fall!!,Winter!!","CSC209H1, CSC263H1/CSC265H1"
CSC309H1,Programming on the Web,"(3, 'Fall')!!",CSC209H1/ESC180H1(unaccounted)/ESC190H1(unaccounted)/CSC190H1(unaccounted)/(APS105H1(unaccounted);ECE244H1(unaccounted)),,,,"Fall!!,Winter!!","CSC209H1/ CSC209H5/ CSCB09H3/ ESC180H1/ ESC190H1/ CSC190H1/ (APS105H1, ECE244H1)"
CSC311H1,Introduction to Machine Learning,"(2, 'Winter')!!",(CSC207H1/APS105H1(unaccounted)/APS106H1(unaccounted)/ESC180H1(unaccounted)/CSC180H1(unaccounted));(MAT136H1/MAT291H1(unaccounted)/MAT294H1(unaccounted)/MAT187H1(unaccounted)/MAT195H1/ESC195H1(unaccounted));(STA237H1/STA247H1(unaccounted)/STA257H1/STA286H1(unaccounted)/CHE223H1(unaccounted)/CME263H1(unaccounted)/MIE231H1(unaccounted)/MIE236H1(unaccounted)/MSE238H1(unaccounted)/ECE286H1(unaccounted)),,"CSC411H1,STA314H1,ECE421H1","Uncleanable string: ""CSC207H1/ APS105H1/ APS106H1/ ESC180H1/ CSC180H1; MAT235Y1/​ MAT237Y1/​ MAT257Y1/​ (minimum of 77% in MAT135H1 and MAT136H1)/ (minimum of 73% in MAT137Y1)/ (minimum of 67% in MAT157Y1)/ MAT291H1/ MAT294H1/ (minimum of 77% in MAT186H1, MAT187H1)/ (minimum of 73% in MAT194H1, MAT195H1)/ (minimum of 73% in ESC194H1, ESC195H1); MAT223H1/ MAT240H1/ MAT185H1/ MAT188H1; STA237H1/ STA247H1/ STA255H1/ STA257H1/ STA286H1/ CHE223H1/ CME263H1/ MIE231H1/ MIE236H1/ MSE238H1/ ECE286H1""","Fall!!,Winter!!","CSC207H1/ APS105H1/ APS106H1/ ESC180H1/ CSC180H1; MAT235Y1/​ MAT237Y1/​ MAT257Y1/​ (minimum of 77% in MAT135H1 and MAT136H1)/ (minimum of 73% in MAT137Y1)/ (minimum of 67% in MAT157Y1)/ MAT291H1/ MAT294H1/ (minimum of 77% in MAT186H1, MAT187H1)/ (minimum of 73% in MAT194H1, MAT195H1)/ (minimum of 73% in ESC194H1, ESC195H1); MAT223H1/ MAT240H1/ MAT185H1/ MAT188H1; STA237H1/ STA247H1/ STA255H1/ STA257H1/ STA286H1/ CHE223H1/ CME263H1/ MIE231H1/ MIE236H1/ MSE238H1/ ECE286H1"
CSC316H1,Data Visualization: Foundations and Advanced Programming,"(2, 'Winter')!!",CSC207H1,,,,Winter!!,CSC207H1
CSC317H1,Computer Graphics,"(3, 'Fall')",,,CSC418H1,,Fall,"MAT235Y1/ MAT237Y1/ MAT257Y1/ MAT291H1/ MAT292H1/ MAT294H1/ (MAT232H5/ MAT233H5, MAT236H5)/ (MATB41H3, MATB42H3); MAT223H1/ MAT240H1/ MAT223H5/ MATA22H3/ MAT185H1/ MAT188H1; CSC209H1/ CSC209H5/ CSCB09H3/ proficiency in C or C++/ APS105H1/ ESC180H1/ CSC180H1"
CSC318H1,The Design of Interactive Computational Media,"(1, 'Winter')!!",ESC180H1(unaccounted)/ESC190H1(unaccounted)/APS105H1(unaccounted)/APS106H1(unaccounted),,,"Prereq: Uncleanable string: ""Any 0.5 credit in CSC/ ESC180H1/ ESC190H1/ APS105H1/ APS106H1""","Fall!!,Winter!!",Any 0.5 credit in CSC/ ESC180H1/ ESC190H1/ APS105H1/ APS106H1
CSC320H1,Introduction to Visual Computing,"(2, 'Winter')!!",(CSC265H1/ECE345H1(unaccounted)/ECE358H1(unaccounted)/MIE335H1(unaccounted)),,,,"Fall,Winter!!","CSC263H1/ CSC265H1/ ECE345H1/ ECE358H1/ MIE335H1, MAT223H1/ MAT240H1/ MAT185H1/ MAT188H1, ( MAT136H1 with a minimum mark of 77)/ (MAT137Y1 with a minimum mark of 73)/ (MAT157Y1 with a minimum mark of 67)/ MAT235Y1/ MAT237Y1/ MAT257Y1/ MAT291H1/ MAT292H1"
CSC324H1,Principles of Programming Languages,"(3, 'Fall')",CSC263H1/CSC265H1,,,,Fall,CSC263H1/CSC265H1
CSC336H1,Numerical Methods,"(2, 'Winter')!!",,,,,Winter!!,"CSC148H1/ CSC111H1; MAT133Y1(70%)/ (MAT135H1, MAT136H1)/ MAT135Y1/ MAT137Y1/ MAT157Y1, MAT223H1/ MAT240H1"
CSC343H1,Introduction to Databases,"(2, 'Winter')!!",(CSC207H1/ECE345H1(unaccounted)/ESC190H1(unaccounted)),,MIE253H1,,"Fall,Winter!!","CSC111H1/ CSC165H1/ ​CSC240H1/ ​(MAT135H1, MAT136H1)/ MAT135Y1/ MAT137Y1/ ​MAT157Y1/ (MAT186H1, MAT187H1)/ (MAT194H1, MAT195H1)/ (ESC194H1, ESC195H1); CSC207H1/ CSC207H5/ CSCB07H3/ ECE345H1/ ESC190H1"
CSC367H1,Parallel Programming,"(3, 'Winter')",CSC258H1;CSC209H1,,,,Winter,CSC258H1/ CSC258H5/ CSCB58H3; CSC209H1/ CSC209H5/ CSCB09H3 
CSC368H1,Computer Architecture,"(3, 'Winter')!!",CSC209H1;CSC258H1,,ECE552H1,,Winter!!,"CSC209H1, CSC258H1 "
CSC369H1,Operating Systems,"(3, 'Fall')!!",CSC209H1;CSC258H1,,,,"Fall!!,Winter!!",CSC209H1/ CSC209H5/ CSCB09H3; CSC258H1/ CSC258H5/ CSCB58H3
CSC373H1,"Algorithm Design, Analysis & Complexity","(2, 'Winter')",CSC265H1,,CSC375H1,,"Fall!!,Winter",CSC263H1/ CSC265H1 / CSC263H5/ CSCB63H3
CSC384H1,Introduction to Artificial Intelligence,"(2, 'Winter')!!",(CSC265H1/ECE345H1(unaccounted)/ECE358H1(unaccounted)/MIE245H1(unaccounted)/CSC148H1);(STA220H1/STA237H1/STA247H1(unaccounted)/STA257H1/ECE302H1(unaccounted)/STA286H1(unaccounted)/CHE223H1(unaccounted)/CME263H1(unaccounted)/MIE231H1(unaccounted)/MIE236H1(unaccounted)/MSE238H1(unaccounted)/ECE286H1(unaccounted)/PSY201H1(unaccounted)),,MIE369H1,"Prereq: 9.0 creditsUncleanable string: ""(CSC263H1/​ CSC265H1/ CSC263H5/ CSCB63H3/ ECE345H1/ ECE358H1/ MIE245H1/ (CSC148H1, enrolled in ASMAJ1446A, completed at least 9.0 credits), STA220H1/ STA237H1/ STA247H1/​ STA255H1/​ STA257H1/ STAB57H3/ STAB52H3/ ECE302H1/ STA286H1/ CHE223H1/ CME263H1/ MIE231H1/ MIE236H1/ MSE238H1/ ECE286H1/ PSY201H1)""","Fall!!,Winter!!","(CSC263H1/​ CSC265H1/ CSC263H5/ CSCB63H3/ ECE345H1/ ECE358H1/ MIE245H1/ (CSC148H1, enrolled in ASMAJ1446A, completed at least 9.0 credits), STA220H1/ STA237H1/ STA247H1/​ STA255H1/​ STA257H1/ STAB57H3/ STAB52H3/ ECE302H1/ STA286H1/ CHE223H1/ CME263H1/ MIE231H1/ MIE236H1/ MSE238H1/ ECE286H1/ PSY201H1)"
CSC399Y1,Research Opportunity Program,"(2, 'Fall-Winter')",,,,,Fall-Winter,
CSC401H1,Natural Language Computing,"(3, 'Fall')",(CSC207H1/CSC209H1/APS105H1(unaccounted)/APS106H1(unaccounted)/ESC180H1(unaccounted)/CSC180H1(unaccounted));(STA237H1/STA247H1(unaccounted)/STA255H1/STA257H1/ECE302H1(unaccounted)/STA286H1(unaccounted)/CHE223H1(unaccounted)/CME263H1(unaccounted)/MIE231H1(unaccounted)/MIE236H1(unaccounted)/MSE238H1(unaccounted)/ECE286H1(unaccounted)),,,,Fall,CSC207H1/ CSC209H1/ CSC207H5/ CSCB07H3/ CSC209H5/ CSCB09H3/ APS105H1/ APS106H1/ ESC180H1/ CSC180H1; STA237H1/ STA247H1/​ STA255H1/ ​STA257H1/ STAB57H3/ STAB52H3/ ECE302H1/ STA286H1/ CHE223H1/ CME263H1/ MIE231H1/ MIE236H1/ MSE238H1/ ECE286H1
CSC404H1,Introduction to Video Game Design,"(2, 'Fall')!!",CSC318H1/CSC417H1(unaccounted)/CSC418H1(unaccounted),,,,"Fall!!,Winter!!",CSC301H1/ CSC317H1/ CSC318H1/ CSC384H1/ CSC417H1/ CSC418H1/ CSC419H1
CSC410H1,Software Testing and Verification,"(3, 'Fall')",CSC207H1,,,,Fall,"CSC207H1, CSC236H1/CSC240H1"
CSC412H1,Probabilistic Learning and Reasoning,"(3, 'Winter')!!",CSC311H1/CSC411H1(unaccounted)/STA314H1/ECE421H1(unaccounted)/ROB313H1(unaccounted),,STA414H1,,Winter!!,CSC311H1/ CSC411H1/ STA314H1/ ECE421H1/ ROB313H1/ CSCC11H3/ CSC311H5
CSC413H1,Neural Networks and Deep Learning,"(3, 'Fall')!!",(CSC311H1/CSC411H1(unaccounted)/ECE421H1(unaccounted)/ROB313H1(unaccounted)),,"CSC321H1,CSC421H1",,"Fall!!,Winter!!","CSC311H1/​ CSC311H5/ CSCC11H3/ CSC411H1/ STA314H1/ ECE421H1/ ROB313H1/; MAT235Y1/​ MAT237Y1/​ MAT257Y1/ MAT257Y5/ MAT291H1/ MAT294H1/ AER210H1/ (MAT232H5, MAT236H5)/ (MAT233H5, MAT236H5)/ (MATB41H3, MATB42H3); MAT223H1/ MAT240H1/ MAT185H1/ MAT188H1/ MAT223H5/ MATA23H3"
CSC419H1,Geometry Processing,"(3, 'Winter')",,,,,Winter,MAT235Y1/ MAT237Y1/ MAT257Y1/ MAT291H1/ MAT294H1; MAT223H1/ MAT240H1/ MAT185H1/ MAT188H1; CSC209H1/ proficiency in C or C++/ APS105H1/ ESC180H1/ CSC180H1
CSC420H1,Introduction to Image Understanding,"(3, 'Fall')",(CSC265H1/ECE345H1(unaccounted)/ECE358H1(unaccounted)/MIE335H1(unaccounted));CSC311H1;CSC311H1,,,"Uncleanable string: ""For 2024-25: CSC263H1/ CSC265H1/ ECE345H1/ ECE358H1/ MIE335H1; (MAT135H1, MAT136H1)/ MAT137Y1/ MAT157Y1/ (MAT186H1, MAT187H1)/ (MAT194H1, MAT195H1)/ (ESC194H1, ESC195H1); MAT223H1/ MAT240H1/ MAT185H1/ MAT188H1  Beginning Fall 2025: CSC263H1/ CSC265H1/ ECE345H1/ ECE358H1/ MIE335H1; CSC311H1; CSC320H1. We encourage students interested in taking CSC420H1 in 2025-26 or beyond to include CSC263H1, CSC311H1 and CSC320H1 in their enrolment plans for 2024-25.""","Fall,Winter!!","For 2024-25: CSC263H1/ CSC265H1/ ECE345H1/ ECE358H1/ MIE335H1; (MAT135H1, MAT136H1)/ MAT137Y1/ MAT157Y1/ (MAT186H1, MAT187H1)/ (MAT194H1, MAT195H1)/ (ESC194H1, ESC195H1); MAT223H1/ MAT240H1/ MAT185H1/ MAT188H1  Beginning Fall 2025: CSC263H1/ CSC265H1/ ECE345H1/ ECE358H1/ MIE335H1; CSC311H1; CSC320H1. We encourage students interested in taking CSC420H1 in 2025-26 or beyond to include CSC263H1, CSC311H1 and CSC320H1 in their enrolment plans for 2024-25."
CSC428H1,Human-Computer Interaction,"(2, 'Winter')!!",CSC318H1;(STA237H1/STA247H1(unaccounted)/STA257H1/ECE302H1(unaccounted)/STA286H1(unaccounted)/CHE223H1(unaccounted)/CME263H1(unaccounted)/MIE231H1(unaccounted)/MIE236H1(unaccounted)/MSE238H1(unaccounted)/ECE286H1(unaccounted));(CSC207H1/APS105H1(unaccounted)/ESC180H1(unaccounted)/CSC180H1(unaccounted)),,,,"Fall!!,Winter!!",CSC318H1; STA237H1/ STA247H1/ ​STA255H1/ ​STA257H1/ ECE302H1/ STA286H1/ CHE223H1/ CME263H1/ MIE231H1/ MIE236H1/ MSE238H1/ ECE286H1; CSC207H1/ APS105H1/ ESC180H1/ CSC180H1
CSC443H1,Database System Technology,"(4, 'Fall')!!",CSC343H1;CSC369H1;(CSC373H1/CSC375H1(unaccounted)),,,,Fall!!,"CSC343H1, CSC369H1, CSC373H1/CSC375H1"
CSC446H1,Computational Methods for Partial Differential Equations,"(3, 'Winter')!!",(CSC351H1(unaccounted)/CSC336H1);(APM346H1/(MAT244H1/MAT267H1)),,,Note: can skip some prereqs with enough math experienceNote: Might need PDE exposure,Winter!!,CSC351H1/ (CSC336H1 (75%))/ equivalent mathematical background; MAT237Y1/ MAT257Y1; APM346H1/ MAT351Y1/ (MAT244H1/ MAT267H1 and exposure to PDEs)
CSC448H1,Formal Languages and Automata,"(2, 'Winter')!!",CSC265H1,,,,Winter!!,"CSC236H1/CSC240H1, CSC263H1/CSC265H1"
CSC454H1,The Business of Software,"(1, 'Winter')!!",,,,"Prereq: ('', '', 's', '', '-', ' or higher', '')",Winter!!,2.5 credits at the 300-level or higher
CSC457H1,Principles of Computer Networks,"(3, 'Winter')!!",CSC373H1;(STA247H1(unaccounted)/STA255H1/STA257H1/STA237H1),,,,Winter!!,"CSC373H1/ CSC373H5/ CSCC73H3, STA247H1/ STA255H1/ STA257H1/ STA237H1"
CSC458H1,Computer Networking Systems,"(3, 'Fall')!!",CSC209H1;CSC258H1;(CSC263H1/CSC265H1);(STA247H1(unaccounted)/STA255H1/STA257H1/STA237H1/ECO227Y1(unaccounted)),,,,"Fall!!,Winter!!","CSC209H1, CSC258H1, CSC263H1/ CSC265H1, STA247H1/ STA255H1/ STA257H1/ STA237H1/ ECO227Y1"
CSC463H1,Computational Complexity and Computability,"(2, 'Fall')!!",,,"CSC363H1,CSC365H1",,Fall!!,CSC236H1/ CSC240H1/ CSC236H5/ CSCB36H3
CSC465H1,Formal Methods in Software Design,"(2, 'Fall')",,,,,Fall,CSC236H1/ CSC240H1/ MAT309H1/ CSC236H5/ CSCB36H3
CSC485H1,Computational Linguistics,"(3, 'Fall')!!",(CSC209H1/APS105H1(unaccounted)/APS106H1(unaccounted)/ESC180H1(unaccounted)/CSC180H1(unaccounted));(STA237H1/STA247H1(unaccounted)/STA255H1/STA257H1/ECE302H1(unaccounted)/STA286H1(unaccounted)/CHE223H1(unaccounted)/CME263H1(unaccounted)/MIE231H1(unaccounted)/MIE236H1(unaccounted)/MSE238H1(unaccounted)/ECE286H1(unaccounted)),,,,Fall!!,CSC209H1/ APS105H1/ APS106H1/ ESC180H1/ CSC180H1; STA237H1/ STA247H1/​ STA255H1/ ​STA257H1/ ECE302H1/ STA286H1/ CHE223H1/ CME263H1/ MIE231H1/ MIE236H1/ MSE238H1/ ECE286H1
CSC486H1,Knowledge Representation and Reasoning,"(3, 'Fall')!!",CSC384H1/ROB311H1(unaccounted),,,,Fall!!,CSC384H1/ CSC384H5/ ROB311H1
CSC488H1,Compilers and Interpreters,"(3, 'Winter')!!",CSC258H1;CSC324H1;(CSC263H1/CSC265H1),,,,Winter!!,"CSC258H1/ CSC258H5/ CSCB58H3, CSC324H1/ CSC324H5/ CSCC24H3, CSC263H1/ CSC265H1/ CSC263H5/ CSCB63H3"
CSC490H1,Capstone Design Project,"(1, 'Winter')",,,,Prereq: 1.5 credits of 300+ level CSC courses,Winter,1.5 credits of 300+ level CSC courses.
CSC491H1,Capstone Design Project,"(1, 'Winter')!!",,CSC454H1,,"Uncleanable string: ""CSC454H1/ CSC2527H""",Winter!!,
CSC494H1,Computer Science Project,"(1, 'Winter')",,,,Prereq: 1.5 credits of 300+ level CSC courses,"Fall,Winter",1.5 credits of 300+ level CSC courses.
CSC494Y1,Computer Science Project,"(2, 'Fall-Winter')",,,,Prereq: 1.5 credits of 300+ level CSC courses,Fall-Winter,1.5 credits of 300+ level CSC courses.
CSC495H1,Computer Science Project,"(2, 'Fall')",CSC494H1,,,Prereq: 1.5 credits of 300+ level CSC courses,"Fall,Winter",CSC494H1. 1.5 credits of 300+ level CSC courses.
ENV237H1,Physics of the Changing Environment A,"(2, 'Winter')",(CHM136H1(unaccounted)/CHM138H1(unaccounted)/CHM135H1(unaccounted)/CHM139H1(unaccounted)/CHM151Y1(unaccounted)),,"ENV238H1,PHY131H1,PHY132H1,PHY151H1,PHY152H1",,Winter,"MAT135H1/MAT136H1/MAT137Y1/MAT157Y1/JMB170Y1, CHM136H1/CHM138H1/CHM135H1/CHM139H1/CHM151Y1"
ENV238H1,Physics of the Changing Environment B,"(2, 'Winter')",(CHM136H1(unaccounted)/CHM138H1(unaccounted)/CHM135H1(unaccounted)/CHM139H1(unaccounted)/CHM151Y1(unaccounted)),,ENV237H1,,Winter,"MAT135H1/MAT136H1/MAT137Y1/MAT157Y1/JMB170Y1, CHM136H1/CHM138H1/CHM135H1/CHM139H1/CHM151Y1, PHY131H1/PHY132H1/PHY151H1/PHY152H1"
JPE395H1,Physics of the Earth,"(3, 'Winter')",(MAT235Y1/MAT237Y1/MAT291H1(unaccounted)/AER210H1(unaccounted));(PHY254H1/PHY293H1(unaccounted)/MAT244H1/MAT267H1/MAT290H1(unaccounted)/MAT292H1(unaccounted)),,,,Winter,"PHY132H1/PHY152H1/PHY180H1/MIE100H1, MAT235Y1/MAT237Y1/MAT291H1/AER210H1, PHY254H1/PHY293H1/MAT244H1/MAT267H1/MAT290H1/MAT292H1"
JPE493H1,Seismology,"(4, 'Fall')",JPE395H1/JGA305H1(unaccounted),APM346H1,,,Fall,JPE395H1/JGA305H1
JPH441H1,Physical Science in Contemporary Society,"(3, 'Fall')",PHY224H1/PHY250H1/PHY252H1/PHY254H1/PHY256H1,,,Note: Can take with instructor permission,Fall,"PHY224H1/PHY250H1/PHY252H1/PHY254H1/PHY256H1, or by permission of the instructor."
JSC270H1,Data Science I,"(2, 'Winter')",STA257H1;CSC207H1,STA261H1,,,Winter,"STA257H1, CSC207H1"
JSC370H1,Data Science II,"(3, 'Winter')",JSC270H1;STA261H1;(CSC263H1/CSC265H1);STA302H1;CSC343H1,STA303H1/STA305H1,,,Winter,"JSC270H1, STA261H1, MAT237Y1/ MAT257Y1, CSC263H1/ CSC265H1/ CSC263H5/ CSCB63H3, STA302H1, CSC343H1/ CSC343H5/ CSCC43H3"
MAT133Y1,Calculus and Linear Algebra for Commerce,"(2, 'Fall-Winter')!!",,,,,Fall-Winter!!,High school level calculus
MAT135H1,Calculus I,"(1, 'Winter')",,,"APS162H1,APS163H1,ESC194H1,ESC195H1,MAT186H1,MAT187H1,MAT196H1,MAT197H1",,"Fall!!,Winter",High school level calculus
MAT136H1,Calculus II,"(2, 'Fall')!!",MAT135H1/APS162H1(unaccounted)/ESC194H1(unaccounted)/MAT186H1(unaccounted)/MAT196H1(unaccounted),,"APS163H1,ESC195H1,MAT187H1,MAT197H1",,"Fall!!,Winter!!",MAT135H1/ MAT135H5/ MATA30H3/ MATA31H3/ APS162H1/ ESC194H1/ MAT186H1/ MAT196H1
MAT137Y1,Calculus with Proofs,"(2, 'Fall-Winter')",,,,,Fall-Winter,High school level calculus
MAT138H1,Introduction to Proofs,"(2, 'Fall')",,,"MAT137Y1,MAT157Y1",,Fall,High school level calculus
MAT157Y1,Analysis I,"(1, 'Fall-Winter')",,,,,Fall-Winter,High school level calculus
MAT195H1,Mathematics as an Interdisciplinary Pursuit,"(1, 'Winter')",,,,,Winter,
MAT198H1,Cryptology: The Mathematics of Secrecy and Security,"(2, 'Fall')",,,,,Fall,High school level algebra.
MAT199H1,Aha! Mathematical Discovery and Creative Problem Solving,"(1, 'Winter')",,,,,Winter,High school level algebra
MAT223H1,Linear Algebra I,"(0, 'Fall')!!",,,"MAT224H1,MAT240H1,MAT247H1,MAT185H1,MAT188H1",,"Fall!!,Winter",High school level calculus
MAT224H1,Linear Algebra II,"(1, 'Winter')!!",,,,,"Fall!!,Winter!!",MAT221H1(80%)/MAT223H1/MAT223H5/ MATA22H3/ MATA23H3/ MAT240H1/MAT240H5
MAT235Y1,Multivariable Calculus,"(2, 'Fall-Winter')!!",,,"MAT237Y1,MAT291H1,MAT294H1",,Fall-Winter!!,"MAT133Y1/ MAT133Y5/ (MATA32H3, MATA33H3)/ (MAT135H1, MAT136H1)/ (MAT135H5, MAT136H5)/ (MATA30H3/ MATA31H3, MATA36H3/MATA37H3)/ MAT137Y1/ MAT137Y5/ (MAT137H5, MAT139H5)/ MAT157Y1/ MAT157Y5/ (MAT157H5, MAT159H5) "
MAT237Y1,Multivariable Calculus with Proofs,"(2, 'Fall-Winter')",,,,,Fall-Winter,"[MAT133Y1/ (MAT135H1, MAT136H1)/ (MAT135H5, MAT136H5)/ (MATA30H3/ MATA31H3, MATA36H3), MAT138H1/ MAT102H5/ MAT246H1]/ MAT137Y1/ MAT137Y5/ (MAT137H5, MAT139H5)/ (MATA30H3/ MATA31H3, MATA37H3)/ MAT157Y1/ MAT157Y5/ (MAT157H5, MAT159H5), MAT223H1/ MATA22H3/ MATA23H3/ MAT240H1/ MAT240H5"
MAT240H1,Algebra I,"(0, 'Fall')",,,,,Fall,High school level calculus
MAT244H1,Introduction to Ordinary Differential Equations,"(2, 'Fall')!!",,,"MAT292H1,MAT267H1",,"Fall!!,Winter!!","(MAT133Y1/ MAT135H1/ MAT135H5/ MATA35H3/ MATA30H3/ MATA31H3, MAT136H1/ MAT136H5/ MATA36H3/ MATA37H3)/ MAT135Y5/ MAT137Y1/ MAT137Y5/ (MAT137H5, MAT139H5)/ MAT157Y1/ MAT157Y5/ (MAT157H5, MAT159H5), MAT223H1/ MATA23H3/ MAT223H5/ MAT240H1/ MAT240H5"
MAT246H1,Concepts in Abstract Mathematics,"(2, 'Winter')!!",((MAT135H1;MAT136H1)),,MAT157Y1,,"Fall!!,Winter!!","MAT133Y1/ MAT133Y5/ (MATA32H3, MATA33H3)/ (MAT135H1, MAT136H1)/ (MAT135H5, MAT136H5)/ (MATA30H3/ MATA31H3, MATA36H3/ MATA37H3)/ MAT137Y1/ MAT137Y5/ (MAT137H5, MAT139H5), MAT223H1/ MATA22H3/ MATA23H3/ MAT240H1/ MAT240H5"
MAT247H1,Algebra II,"(1, 'Winter')!!",,,,,Winter!!,MAT240H1/ MAT240H5
MAT257Y1,Analysis II,"(2, 'Fall-Winter')",,,,,Fall-Winter,"MAT157Y1/ (MAT157H5, MAT159H5)/ MAT157Y5, MAT247H1/ MAT247H5"
MAT267H1,Advanced Ordinary Differential Equations,"(2, 'Winter')!!",,,"MAT234H1,MAT292H1",,Winter!!,"MAT157Y1/ (MAT157H5, MAT159H5)/ MAT157Y5, MAT247H1/ MAT247H5"
MAT271H1,Insights from Mathematics,"(2, 'Fall')",,,,,Fall,
MAT296H1,Independent Reading in Mathematics,"(1, 'Winter')",,,,Note: Need undergrad chair permission,"Fall,Winter",Minimum GPA of 3.5 in APM and MAT courses. Permission of the Associate Chair for Undergraduate Studies and of the prospective supervisor.
MAT301H1,Groups and Symmetries,"(2, 'Fall')!!",()/(MAT185H1(unaccounted);MAT194H1(unaccounted);MAT195H1),,MAT347Y1,,"Fall!!,Winter!!","MAT257Y1/ (MAT224H1/ MAT247H1, MAT235Y1/ MAT237Y1, MAT246H1/ MAT157Y1/ (MAT157H5, MAT159H5)/ MAT157Y5/ CSC236H1/ CSC240H1)/ (MAT185H1, MAT194H1, MAT195H1)"
MAT309H1,Introduction to Mathematical Logic,"(3, 'Fall')",,,CSC438H1,,Fall,"MAT257Y1/ [MAT223H1/ MATA23H3/ MAT223H5/ MAT240H1/ MAT240H5, MAT235Y1/ MAT235Y5/ (MAT232H5, MAT236H5)/ (MATB41H3, MATB42H3/ MATB43H3)/ MAT237Y1/ MAT237Y5, MAT246H1/ MAT157Y1/ (MAT157H5, MAT159H5)/ MAT157Y5/ CSC236H1/ CSC240H1]"
MAT315H1,Introduction to Number Theory,"(2, 'Fall')!!",,,,,"Fall!!,Winter!!","(MAT223H1/ MATA23H3/ MAT223H5/ MAT240H1/ MAT240H5, MAT235Y1/ MAT235Y5/ (MAT232H5, MAT236H5)/ (MATB41H3, MATB42H3)/ MAT237Y1/ (MATB41H3, MATB42H3, MATB43H3)/ MAT237Y5, MAT246H1/ CSC236H1/ CSC240H1)/ MAT157Y1/ MAT157Y5/ (MAT157H5, MAT159H5)/ MAT247H1/ MAT247H5"
MAT327H1,Introduction to Topology,"(2, 'Fall')!!",,,,,Fall!!,"MAT157Y1/ MAT157Y5/ (MAT157H5, MAT159H5)/ [(MAT237Y1/ (MATB41H3, MATB42H3/ MATB43H3)/ MAT237Y5), MAT246H1]"
MAT329Y1,Concepts in Elementary Mathematics,"(2, 'Fall-Winter')",,,,"Need 5.0 credits with a CGPA of at least 2.5, and",Fall-Winter,"5.0 credits with a CGPA of at least 2.5, and MAT137Y1/ MAT137Y5/ (MAT137H5, MAT139H5)/ MAT138H1/ (MAT223H1/ MAT240H1)/ [MAT246H1/ MAT157Y1/ MAT157Y5/ (MAT157H5, MAT159H5)] "
MAT332H1,Introduction to Graph Theory,"(2, 'Fall')!!",,,,,Fall!!,MAT224H1/MATB24H3/MAT224H5/MAT247H1/MAT247H5
MAT334H1,Complex Variables,"(3, 'Fall')!!",,,MAT354H1,,"Fall!!,Winter!!","MAT223H1/MATA23H3/MAT223H5/MAT240H1/MAT240H5, MAT235Y1/MAT235Y5/(MAT232H5, MAT236H5)/(MATB41H3, MATB42H3)/MAT237Y1/(MATB41H3, MATB42H3, MATB43H3)/MAT237Y5/MAT257Y1"
