,Title,Earliest Semester Takeable,Prereqs,Coreqs,Exclusions,Notes,Semesters Available,Raw Prereqs
MAT335H1,"Chaos, Fractals and Dynamics","(2, 'Winter')",,,,,Winter,"MAT137Y1/ (MATA30H3, MATA31H3, MATA37H3)/ MAT137Y5/ (MAT137H5, MAT139H5)/ MAT157Y1/ MAT157Y5/ (MAT157H5, MAT159H5)/ MAT235Y1/ MAT235Y5/ (MAT232H5, MAT236H5)/ (MATB41H3, MATB42H3)/ MAT237Y1/ (MATB41H3, MATB42H3, MATB43H3)/ MAT237Y5, MAT223H1/ MATA23H3/ MAT223H5/ MAT240H1/ MAT240H5"
MAT336H1,Elements of Analysis,"(2, 'Winter')!!",((MAT185H1(unaccounted);(MAT195H1/ESC195H1(unaccounted)))),,"MAT257Y1,MAT337H1",,Winter!!,"MAT223H1/ MATA23H3/ MAT223H5/ MAT240H1/ MAT240H5, MAT235Y1/ MAT235Y5/ (MAT232H5, MAT236H5)/ (MATB41H3, MATB42H3)/ MAT237Y1/ (MATB41H3, MATB42H3, MATB43H3)/ MAT237Y5/ (MAT185H1, MAT195H1/ ESC195H1)"
MAT337H1,Introduction to Real Analysis,"(3, 'Fall')",,,MAT357H1,,"Fall,Winter!!","MAT257Y1/ [MAT224H1/ MATA24H3/ MAT224H5/ MAT247H1/ MAT247H5, MAT235Y1/ MAT235Y5/ (MAT232H5, MAT236H5)/ (MATB41H3, MATB42H3/ MATB43H3)/ MAT237Y1/ MAT237Y5, MAT246H1/ MAT157Y1]"
MAT344H1,Introduction to Combinatorics,"(1, 'Winter')!!",,,,,"Fall!!,Winter!!",MAT223H1/MATA23H3/MAT223H5/MAT240H1/MAT240H5
MAT347Y1,"Groups, Rings and Fields","(2, 'Fall-Winter')",,,,,Fall-Winter,MAT257Y1/(85% in MAT247H1/MAT247H5)
MAT351Y1,Partial Differential Equations,"(3, 'Fall-Winter')!!",MAT267H1,,APM351Y1,,Fall-Winter!!,"MAT257Y1/ MAT237Y1 (85%), MAT267H1"
MAT354H1,Complex Analysis I,"(3, 'Fall')!!",,,,,Fall!!,MAT257Y1
MAT357H1,Foundations of Real Analysis,"(3, 'Winter')",,,,,Winter,MAT257Y1
MAT363H1,Geometry of Curves and Surfaces,"(2, 'Winter')!!",,,,Note: ,Winter!!,"MAT224H1/ MATB24H3/ MAT224H5/ MAT247H1/ MAT247H5, MAT237Y1/ (MATB41H3, MATB42H3, MATB43H3)/ MAT237Y5/ MAT257Y1 (MAT257Y1 can be taken concurrently). For FASE students, MAT185H1, MAT194H1, MAT195H1, AER210H1."
MAT367H1,Differential Geometry,"(3, 'Winter')!!",,,,,Winter!!,"MAT257Y1/ [MAT224H1/ MAT247H1, MAT237Y1, MAT246H1/ MAT157Y1/ MAT157Y5/ (MAT157H5, MAT159H5)]"
MAT370H1,Introduction to Mathematical Probability,"(3, 'Fall')",MAT224H1;MAT246H1,,MAT377H1,,Fall,"MAT224H1/ MAT224H5, MAT235Y1/ (MAT232H5, MAT236H5)/ MAT237Y1/ MAT257Y1, MAT246H1"
MAT377H1,Mathematical Probability Theory,"(3, 'Fall')!!",,,"MAT370H1,STA347H1",,Fall!!,"MAT247H1/MAT247H5, MAT257Y1"
MAT390H1,History of Mathematics up to 1700,"(2, 'Fall')!!",,,"HPS309H1,HPS310Y1,HPS390H1","Prereq: ('', '', '', '', '-')",Fall!!,1.0 APM/MAT credit at the 200-level
MAT391H1,History of Mathematics after 1700,"(1, 'Winter')!!",,,"HPS309H1,HPS310H1,HPS391H1","Prereq: ('', '', '', '', ' ')",Winter!!,1.0 APM/MAT credit at the 200 level
MAT395H1,Independent Reading in Mathematics,"(1, 'Winter')",,,,Note: Need undergrad chair permission,"Fall,Winter",Minimum GPA of 3.5 in APM and MAT courses. Permission of the Associate Chair for Undergraduate Studies and of the prospective supervisor
MAT396H1,Independent Reading in Mathematics,"(1, 'Winter')",,,,Note: Need undergrad chair permission,"Fall,Winter,Fall-Winter",Minimum GPA of 3.5 in APM and MAT courses. Permission of the Associate Chair for Undergraduate Studies and of the prospective supervisor.
MAT397Y1,Research Project in Mathematics,"(2, 'Fall-Winter')",,,,Note: Need undergrad chair permission,Fall-Winter,Minimum GPA of 3.5 in APM and MAT courses. Permission of the Associate Chair for Undergraduate Studies and of the prospective supervisor.
MAT401H1,Polynomial Equations and Fields,"(2, 'Winter')",MAT301H1,,MAT347Y1,,Winter,MAT301H1
MAT402H1,Classical Geometries,"(3, 'Fall')",(MAT301H1/MAT347Y1),,,,Fall,"MAT301H1/MAT347Y1, MAT235Y1/MAT237Y1/MAT257Y1"
MAT403H1,Classical Geometries II,"(3, 'Winter')",(MAT301H1/MAT347Y1),,,,Winter,"MAT235Y1/ MAT237Y1/ MAT257Y1, MAT301H1/ MAT347Y1"
MAT409H1,Set Theory,"(4, 'Fall')",MAT357H1,,,,Fall,MAT357H1
MAT415H1,Algebraic Number Theory,"(3, 'Winter')",MAT347Y1,,,,Winter,MAT347Y1
MAT425H1,Differential Topology,"(3, 'Winter')",MAT327H1,,,,Winter,"MAT257Y1, MAT327H1"
MAT436H1,Introduction to Linear Operators,"(3, 'Fall')!!",,,,"Uncleanable string: ""5.0 MAT credits, including MAT224H1/MAT247H1 and MAT237Y1/MAT257Y1""",Fall!!,"5.0 MAT credits, including MAT224H1/MAT247H1 and MAT237Y1/MAT257Y1"
MAT437H1,K-Theory and C* Algebras,"(3, 'Winter')!!",,,,"Uncleanable string: ""5.0 MAT credits, including MAT224H1/MAT247H1 and MAT237Y1/MAT257Y1""",Winter!!,"5.0 MAT credits, including MAT224H1/MAT247H1 and MAT237Y1/MAT257Y1"
MAT445H1,Representation Theory,"(3, 'Winter')",MAT347Y1,,,,Winter,MAT347Y1
MAT449H1,Algebraic Curves,"(3, 'Winter')",MAT347Y1;MAT354H1,,,,Winter,"MAT347Y1, MAT354H1"
MAT454H1,Complex Analysis II,"(3, 'Winter')!!",MAT354H1,,,,Winter!!,MAT354H1
MAT457H1,Advanced Real Analysis I,"(4, 'Fall')",MAT357H1,,MAT457Y1,,Fall,MAT357H1
MAT458H1,Advanced Real Analysis II,"(4, 'Winter')!!",MAT457H1,,MAT457Y1,,Winter!!,MAT457H1
MAT461H1,Hamiltonian Mechanics,"(3, 'Winter')",(MAT244H1/MAT267H1);MAT337H1;APM346H1,,,,Winter,"MAT244H1/ MAT267H1, MAT337H1/ MAT367H1, APM346H1/ MAT351Y1"
MAT464H1,Riemannian Geometry,"(4, 'Fall')",MAT367H1,,,,Fall,MAT367H1
MAT475H1,Problem Solving Seminar,"(3, 'Fall')!!",,,,"Prereq: ('and ', 'at least ', '', '', '+ ', '', ' in APM/MAT')",Fall!!,"MAT224H1/MAT247H1, MAT235Y1/MAT237Y1/MAT257Y1, and at least 1.0 credit at the 300+ level in APM/MAT"
MAT477H1,Seminar in Mathematics,"(4, 'Fall')",MAT347Y1;MAT354H1;MAT357H1,,,,"Fall,Winter","MAT347Y1, MAT354H1, MAT357H1"
MAT482H1,Topics in Mathematics,"(2, 'Fall')",,,,Note: Possible topic-specific prereqsPrereq: s,Fall,"6.0 APM/MAT credits at the 100, 200 and 300-level. Possible additional topic-specific prerequisites."
MAT495H1,Independent Reading in Mathematics,"(1, 'Winter')",,,,Note: Need undergrad chair permission,"Fall,Winter",Minimum GPA of 3.5 in APM and MAT courses. Permission of the Associate Chair for Undergraduate Studies and of the prospective supervisor
MAT496H1,Independent Reading in Mathematics,"(1, 'Winter')",,,,Note: Need undergrad chair permission,"Fall,Winter",Minimum GPA of 3.5 in APM and MAT courses. Permission of the Associate Chair for Undergraduate Studies and of the prospective supervisor.
MAT497Y1,Research Project in Mathematics,"(2, 'Fall-Winter')",,,,Note: Need undergrad chair permission,Fall-Winter,Minimum GPA of 3.5 in APM and MAT courses. Permission of the Associate Chair for Undergraduate Studies and of the prospective supervisor
PHY100H1,The Magic of Physics,"(2, 'Fall')!!",,,"PHY196H1,PHY197H1,PHY198H1,PHY199H1,PHY202H1,PHY205H1,PHY207H1",,Fall!!,
PHY131H1,Introduction to Physics I,"(1, 'Winter')!!",,,PHY151H1,,"Fall!!,Winter!!",
PHY132H1,Introduction to Physics II,"(1, 'Winter')!!",,,PHY152H1,,Winter!!,PHY131H1/ PHY151H1
PHY151H1,Foundations of Physics I,"(0, 'Fall')",,,PHY131H1,,Fall,MCV4U Calculus & Vectors / MCB4U Functions & Calculus; SPH4U Physics
PHY152H1,Foundations of Physics II,"(0, 'Fall')",,,PHY132H1,,Winter!!,PHY131H1/PHY151H1/PHY180H1
PHY196H1,Emergence in Nature,"(1, 'Winter')!!",,,,,Winter!!,"No prior experience with physical science will be required, but familiarity with Grade 10 mathematics will be assumed."
PHY197H1,Modern Physics for the Curious,"(2, 'Fall')",,,,,Fall,"No prior experience with physical science will be required, but familiarity with Grade 10 mathematics will be assumed. "
PHY198H1,Physics at the Cutting Edge,"(1, 'Winter')!!",,,,,Winter!!,PHY151H1
PHY199H1,Dark Matter and Dark Energy are the New Black,"(1, 'Winter')!!",,,,,Winter!!,"No prior experience with physical science will be required, but familiarity with Grade 10 mathematics will be assumed."
PHY205H1,The Physics of Everyday Life,"(1, 'Winter')",,,"PHY196H1,PHY197H1,PHY198H1,PHY199H1,PHY100H1,PHY202H1,PHY207H1",,Winter,
PHY207H1,The Physics of Music,"(1, 'Winter')!!",,,"PHY196H1,PHY197H1,PHY198H1,PHY199H1,PHY100H1,PHY202H1,PHY205H1",,Winter!!,
PHY224H1,Practical Physics I,"(2, 'Fall')",,PHY231H1/PHY254H1/PHY256H1,,,"Fall,Winter!!","PHY131H1/ PHY151H1, PHY132H1/ PHY152H1, (MAT135H1, MAT136H1)/ MAT137Y1/ MAT157Y1"
PHY231H1,Physics of Living Systems,"(2, 'Fall')",,,,,Fall,"PHY131H1/ PHY151H1, PHY132H1/ PHY152H1, (MAT135H1, MAT136H1)/ MAT137Y1/ MAT157Y1"
PHY250H1,Electricity and Magnetism,"(2, 'Winter')!!",,,,,Winter!!,"PHY131H1/ PHY151H1, PHY132H1/ PHY152H1, (MAT135H1, MAT136H1)/ MAT137Y1/ MAT157Y1"
PHY252H1,Thermal Physics,"(2, 'Winter')!!",,,,,Winter!!,"PHY131H1/ PHY151H1, PHY132H1/ PHY152H1, (MAT135H1, MAT136H1)/ MAT137Y1/ MAT157Y1"
PHY254H1,Classical Mechanics,"(2, 'Fall')!!",,,,,Fall!!,"PHY131H1/ PHY151H1, PHY132H1/ PHY152H1, (MAT135H1, MAT136H1)/ MAT137Y1/ MAT157Y1"
PHY256H1,Introduction to Quantum Physics,"(2, 'Fall')!!",,,,,Fall!!,"PHY131H1/ PHY151H1, PHY132H1/ PHY152H1, (MAT135H1, MAT136H1)/ MAT137Y1/ MAT157Y1"
PHY299Y1,Research Opportunity Program,"(2, 'Fall-Winter')",,,,,Fall-Winter,
PHY324H1,Practical Physics II,"(2, 'Winter')",PHY224H1;(PHY231H1/PHY254H1/PHY256H1),,,,"Fall,Winter","PHY224H1, PHY231H1/ PHY250H1/ PHY252H1/ PHY254H1/ PHY256H1"
PHY331H1,Introduction to Biological Physics,"(3, 'Fall')",(PHY252H1/CHM222H1(unaccounted));(PHY231H1/PHY250H1/PHY254H1/PHY256H1),,,,Fall,"PHY252H1/ CHM222H1, PHY231H1/ PHY250H1/ PHY254H1/ PHY256H1"
PHY350H1,Electromagnetic Theory,"(3, 'Fall')!!",(MAT244H1/MAT267H1);PHY250H1,,,,Fall!!,"MAT223H1/ MAT240H1, MAT244H1/ MAT267H1, MAT235Y1/ MAT237Y1/ MAT257Y1, PHY250H1"
PHY354H1,Advanced Classical Mechanics,"(3, 'Winter')!!",(MAT244H1/MAT267H1);PHY254H1,,,,Winter!!,"MAT223H1/ MAT240H1, MAT244H1/ MAT267H1, MAT235Y1/ MAT237Y1/ MAT257Y1, PHY254H1"
PHY356H1,Quantum Mechanics I,"(3, 'Fall')!!",PHY250H1;(PHY256H1/(CHM222H1(unaccounted);CHM223H1(unaccounted)));PHY256H1,MAT244H1,CHM326H1,,Fall!!,"MAT223H1/ MAT240H1, MAT235Y1/ MAT237Y1/ MAT257Y1, PHY250H1, PHY256H1/ (CHM222H1, CHM223H1), (PHY256H1 recommended)"
PHY357H1,Nuclear and Particle Physics,"(3, 'Winter')",PHY356H1,,,,Winter,PHY356H1
PHY358H1,Quantum Materials: from Atoms to Crystals,"(3, 'Winter')",PHY356H1,,,,Winter,PHY356H1
PHY365H1,Quantum Information,"(2, 'Winter')",(PHY256H1/PHY294H1(unaccounted)/CHM223H1(unaccounted)/ECE330H1(unaccounted)),,,Note:  can contact department for prereq exemptions(.),Winter,"PHY256H1/ PHY294H1/ CHM223H1/ ECE330H1, MAT223H1/ MAT240H1 (Students who do not meet these prerequisites are encouraged to contact the Department.)"
PHY371Y1,Supervised Study in Physics,"(2, 'Fall-Winter')",,,,Note: Need undergrad chair permission,Fall-Winter,Consult the Physics Associate Chair (Undergraduate Studies)
PHY372H1,Supervised Study in Physics,"(1, 'Winter')",,,,Note: Need undergrad chair permission,"Fall,Winter",Consult the Physics Associate Chair (Undergraduate Studies)
PHY378H1,Undergraduate Research Project,"(1, 'Winter')",,,,Note: Need undergrad chair permission,"Fall,Winter",Consult the Physics Associate Chair (Undergraduate Studies)
PHY379Y1,Undergraduate Research Project,"(2, 'Fall-Winter')",,,,Note: Need undergrad chair permission,Fall-Winter,Consult the Physics Associate Chair (Undergraduate Studies)
PHY385H1,Introductory Optics,"(3, 'Winter')!!",PHY250H1;PHY224H1,,ECE318H1,,Winter!!,"PHY250H1, PHY224H1, MAT235Y1/ MAT237Y1/ MAT257Y1"
PHY392H1,Physics of Climate,"(3, 'Fall')",(PHY250H1/PHY252H1),,,,Fall,"PHY250H1/PHY252H1, MAT235Y1/MAT237Y1/MAT257Y1"
PHY405H1,Electronics Lab,"(2, 'Winter')!!",PHY224H1,,,"Uncleanable string: ""PHY224H1, PHY250H1. Note that PHY405H1 may be taken in third or fourth year.""",Winter!!,"PHY224H1, PHY250H1. Note that PHY405H1 may be taken in third or fourth year."
PHY407H1,Computational Physics,"(3, 'Fall')!!",PHY224H1;(PHY250H1/PHY252H1/PHY254H1/PHY256H1),,,"Uncleanable string: ""Any 300/ 400-level lecture course in Physics (PHY/ JPE)""",Fall!!,"PHY224H1, PHY250H1/ PHY252H1/ PHY254H1/ PHY256H1, MAT235Y1/ MAT237Y1/ MAT257Y1"
PHY408H1,Time Series Analysis,"(3, 'Winter')!!",PHY224H1;(PHY250H1/PHY252H1/PHY254H1/PHY256H1),,,"Uncleanable string: ""Any 300/ 400-level lecture course in Physics (PHY/ JPE)""",Winter!!,"PHY224H1, PHY250H1/ PHY252H1/ PHY254H1/ PHY256H1, MAT235Y1/ MAT237Y1/ MAT257Y1."
PHY424H1,Advanced Physics Laboratory,"(3, 'Fall')!!",PHY250H1;PHY256H1;PHY324H1,,,,"Fall!!,Winter!!","PHY250H1, PHY256H1, PHY324H1"
PHY426H1,Advanced Practical Physics I,"(3, 'Winter')",PHY424H1,,,,"Fall,Winter",PHY424H1
PHY428H1,Advanced Practical Physics II,"(4, 'Fall')",PHY426H1,,,,"Fall,Winter",PHY426H1
PHY429H1,Advanced Practical Physics III,"(4, 'Winter')",PHY428H1,,,,"Fall,Winter",PHY428H1
PHY431H1,Topics in Biological Physics,"(3, 'Winter')",PHY250H1;(PHY252H1/CHM222H1(unaccounted));PHY331H1,,,,Winter,"PHY250H1, PHY252H1/ CHM222H1, PHY331H1"
PHY450H1,Relativistic Electrodynamics,"(4, 'Winter')",PHY350H1;PHY354H1,,,,Winter,"PHY350H1, PHY354H1"
PHY452H1,Statistical Mechanics,"(3, 'Winter')",PHY252H1;PHY356H1,,,,Winter,"PHY252H1, PHY356H1"
PHY454H1,Continuum Mechanics,"(3, 'Winter')",PHY254H1;(APM346H1/APM351Y1(unaccounted)),,,,Winter,"PHY254H1, MAT235Y1/MAT237Y1/MAT257Y1, APM346H1/APM351Y1"
PHY456H1,Quantum Mechanics II,"(4, 'Fall')!!",PHY356H1,,,,Fall!!,PHY356H1
PHY460H1,Nonlinear Physics,"(4, 'Fall')",PHY354H1,,,,Fall,PHY354H1
PHY471Y1,Supervised Study in Physics,"(2, 'Fall-Winter')",,,,Note: Need undergrad chair permission,Fall-Winter,Consult the Physics Associate Chair (Undergraduate Studies).
PHY472H1,Supervised Study in Physics,"(1, 'Winter')",,,,Note: Need undergrad chair permission,"Fall,Winter",Consult the Physics Associate Chair (Undergraduate Studies).
PHY478H1,Undergraduate Research Project,"(1, 'Winter')",,,,Note: Need undergrad chair permission,"Fall,Winter",Consult the Physics Associate Chair (Undergraduate Studies)
PHY479Y1,Undergraduate Research Project,"(2, 'Fall-Winter')",,,,Note: Need undergrad chair permission,Fall-Winter,Consult the Physics Associate Chair (Undergraduate Studies)
PHY483H1,Relativity Theory I,"(4, 'Fall')",PHY354H1,,,,Fall,PHY354H1
PHY484H1,Relativity Theory II,"(4, 'Winter')!!",PHY483H1,,,,Winter!!,PHY483H1
PHY485H1,Laser Physics,"(4, 'Winter')",PHY350H1;PHY356H1;(PHY385H1/ECE318H1(unaccounted)),,,,Winter,"PHY350H1, PHY356H1, PHY385H1/ ECE318H1"
PHY487H1,Condensed Matter Physics,"(4, 'Fall')",PHY250H1;PHY252H1;PHY356H1,,,,Fall,"PHY250H1, PHY252H1, PHY356H1"
PHY489H1,Introduction to High Energy Physics,"(4, 'Fall')",PHY356H1,,,,Fall,PHY356H1
PHY491H1,Current Interpretations of Quantum Mechanics,"(4, 'Winter')",PHY456H1,,,,Winter,PHY456H1
PHY492H1,Advanced Atmospheric Physics,"(3, 'Fall')",PHY224H1;(PHY250H1/PHY252H1/PHY254H1),,,,Fall,"PHY224H1, PHY250H1/ PHY252H1/ PHY254H1, MAT235Y1/ MAT237Y1/ MAT257Y1"
STA130H1,An Introduction to Statistical Reasoning and Data Science,"(1, 'Winter')!!",,,"STA220H1,STA255H1,STA238H1,STA248H1,STA261H1,ECO220Y1,ECO227Y1",*Note: the corequisite may be completed either concurrently or in advance,"Fall!!,Winter!!",
STA197H1,Thinking Better with Statistics,"(2, 'Fall')!!",,,,,Fall!!,
STA198H1,Probabilities Everywhere,"(1, 'Winter')!!",,,,,Winter!!,Grade 12 Mathematics
STA199H1,Statistical Evidence: Truth or Myth?,"(1, 'Winter')!!",,,,,Winter!!,
STA201H1,Why Numbers Matter,"(2, 'Fall')",,,"MAT133Y1,MAT135H1,MAT136H1,MAT137Y1,MAT157Y1",,Fall,
STA220H1,The Practice of Statistics I,"(1, 'Winter')!!",,,"ECO220Y1,ECO227Y1,GGR270H1,IRW220H1,PSY201H1,SOC202H1,STA261H1,STA238H1,STA248H1,STA288H1,EEB225H1",,"Fall!!,Winter!!",
STA221H1,The Practice of Statistics II,"(2, 'Winter')!!",STA220H1/STA288H1/PSY201H1(unaccounted)/GGR270H1(unaccounted)/EEB225H1(unaccounted),,"ECO220Y1,ECO227Y1,GGR270Y1,PSY202H1,SOC202H1,SOC252H1,STA261H1,STA248H1",,Winter!!,STA220H1/ STA288H1/ PSY201H1/ GGR270H1/ EEB225H1/ STAB22H3/ STA220H5
STA237H1,"Probability, Statistics and Data Analysis I","(2, 'Fall')!!",,,"STA247H1,STA255H1,STA257H1,ECO227Y1,MAT370H1",*Note: the corequisite may be completed either concurrently or in advance,Fall!!,"(MAT135H1, MAT136H1)/ MAT137Y1/ MAT157Y1/ (MATA30H3, MATA36H3)/ (MATA31H3, MATA37H3)/ (MAT135H5, MAT136H5)/ MAT137Y5/ MAT157Y5"
STA238H1,"Probability, Statistics and Data Analysis II","(2, 'Winter')!!",STA237H1/STA247H1(unaccounted)/STA257H1,,"ECO220Y1,ECO227Y1,GGR270H1,PSY201H1,SOC300H1,SOC202H1,SOC252H1,STA220H1,STA221H1,STA255H1,STA248H1,STA261H1,STA288H1,EEB225H1",*Note: the corequisite may be completed either concurrently or in advance,Winter!!,STA237H1/ STA247H1/ STA257H1/ STAB52H3/ STA256H5
STA255H1,Statistical Theory,"(2, 'Winter')!!",(STA220H1/STA288H1),,"ECO227Y1,STA237H1,STA238H1,STA257H1,STA261H1,STA247H1,STA248H1",note: ECO220Y1 may be taken as a co-requisite,Winter!!,"STA220H1/ STA221H1/ STA288H1/ ECO220Y1 (note: ECO220Y1 may be taken as a co-requisite)/ STAB22H3/ STA220H5/ ECO220Y5; MAT133Y1 (70%)/ (MAT135H1, MAT136H1)/ MAT137Y1/ MAT157Y1/ (MATA32H3 (70%), MATA33H3 (70%))/ (MATA29H3 (70%), MATA35H3 (70%))/ (MATA30H3, MATA36H3)/ (MATA31H3, MATA37H3)/ MAT133Y5 (70%)/ (MAT132H5 (70%), MAT134H5 (70%))/ (MAT135H5,MAT136H5)/ MAT137Y5/ MAT157Y5"
STA257H1,Probability and Statistics I,"(2, 'Fall')",,,"ECO227Y1,STA237H1,STA247H1,MAT370H1,MAT377H1",,Fall,"MAT137Y1/ MAT157Y1/ (MATA31H3, MATA37H3)/ MAT137Y5/ MAT157Y5"
STA261H1,Probability and Statistics II,"(2, 'Winter')",STA257H1,,"ECO227Y1,STA238H1,STA248H1",,Winter,STA257H1/ STAB52H3/ STA256H5
STA288H1,Statistics and Scientific Inquiry in the Life Sciences,"(1, 'Winter')",BIO230H1(unaccounted)/BIO255H1(unaccounted),,"STA220H1,PSY201H1,GGR270H1,ECO220Y1,ECO227Y1,SOC202H1,EEB225H1,HMB325H1,STA238H1,STA248H1,STA261H1,PCL376H1",,Winter,BIO230H1/BIO255H1
STA299Y1,Research Opportunity Program,"(2, 'Fall-Winter')",,,,,Fall-Winter,
STA302H1,Methods of Data Analysis I,"(3, 'Fall')!!",(STA238H1/STA248H1(unaccounted)/STA255H1/STA261H1/ECO227Y1(unaccounted)),,,,"Fall!!,Winter",STA238H1/ STA248H1/ STA255H1/ STA261H1/ ECO227Y1/ STAB57H3/ STA258H5/ STA260H5/ ECO227Y5; CSC108H1/ CSC110Y1/ CSC120H1/ CSC148H1/ CSCA08H3/ CSCA20H3/ CSCA48H3/ CSC108H5/ CSC148H5; MAT223H1/ MAT224H1/ MAT240H1/ MATA22H3/ MATA23H3/ MAT223H5/ MAT240H5/ MATB24H3/ MAT224H5
STA303H1,Methods of Data Analysis II,"(3, 'Winter')",STA302H1,,,,Winter,STA302H1/STAC67H3/STA302H5
STA304H1,"Surveys, Sampling and Observational Data","(3, 'Fall')",ECO227Y1(unaccounted)/STA255H1/STA261H1/STA248H1(unaccounted)/STA238H1,,,,"Fall,Winter!!",ECO227Y1/ STA255H1/ STA261H1/ STA248H1/ STA238H1/ STAB57H3/ STA258H5/ STA260H5/ ECO227Y5
STA305H1,Design and Analysis of Experiments,"(3, 'Winter')",STA302H1,,,,Winter,STA302H1/STAC67H3/STA302H5
STA313H1,Data Visualization,"(3, 'Fall')!!",(STA238H1/STA248H1(unaccounted)/STA261H1/ECO227Y1(unaccounted)),,,,Fall!!,CSC108H1/ CSC110Y1/ CSC120H1/ CSC148H1; STA238H1/ STA248H1/ STA261H1/ ECO227Y1
STA314H1,Statistical Methods for Machine Learning I,"(4, 'Fall')!!",STA302H1,,"CSC411H1,CSC311H1",,Fall!!,"STA302H1/ STA302H5/ STAC67H3; CSC108H1/ CSC110Y1/ CSC120H1/ CSC148H1/ CSCA08H3/ CSCA48H3/ CSCA20H3/ CSC108H5/ CSC148H5; MAT223H1/ MAT224H1/ MAT240H1/ MATA22H3/ MATA23H3/ MAT223H5/ MAT240H5/ MATB24H3/ MAT224H5; MAT235Y1/ MAT237Y1/ MAT257Y1/ (MATB41H3, MATB42H3)/ (MAT232H5, MAT236H5)/ (MAT233H5, MAT236H5)"
STA347H1,Probability,"(3, 'Fall')",(STA247H1(unaccounted)/STA255H1/STA237H1/STA257H1/ECO227Y1(unaccounted)),,"MAT370H1,MAT377H1","('are ', '')","Fall,Winter!!","STA247H1(70%)/ STA255H1(70%)/ STA237H1(70%)/ STA257H1/ ECO227Y1/ STAB52H3/ STA256H5; MAT223H1/ MAT224H1/ MAT240H1/ MATA22H3/ MATA23H3/ MAT223H5/ MAT240H5/ MATB24H3/ MAT224H5; MAT235Y1/ MAT237Y1/ MAT257Y1/ (MATB41H3, MATB42H3)/ (MAT232H5, MAT236H5)/ (MAT233H5, MAT236H5) (Note: STA257H1, MAT223H1/MAT240H1, MAT237Y1/MAT257Y1 are very strongly recommended)"
STA355H1,Theory of Statistical Practice,"(3, 'Fall')",(STA255H1/STA248H1(unaccounted)/STA238H1/STA261H1/ECO227Y1(unaccounted)),,,,Fall,"STA255H1 (73%)/ STA248H1 (73%)/ STA238H1 (73%)/ STA261H1 (60%)/ ECO227Y1 (60%)/ STAB57H3 (60%)/ STA260H5 (60%)/ ECO227Y5 (60%); MAT235Y1/ MAT237Y1/ MAT257Y1/ (MATB41H3, MATB42H3)/ (MAT232H5, MAT236H5)/ (MAT233H5, MAT236H5); MAT223H1/ MAT224H1/ MAT240H1/ MATA22H3/ MATA23H3/ MAT223H5/ MAT240H5/ MATB24H3/ MAT224H5"
STA365H1,Applied Bayesian Statistics,"(3, 'Winter')",STA302H1,,,,Winter,STA302H1/STAC67H3/STA302H5
STA399Y1,Research Opportunity Program,"(2, 'Fall-Winter')",,,,,Fall-Winter,
STA410H1,Statistical Computation,"(3, 'Winter')",STA302H1,,,,Winter,STA302H1/ STAC67H3/ STA302H5; CSC110Y1/ CSC148H1/ CSCA48H3/ CSC148H5; MAT223H1/ MAT224H1/ MAT240H1/ MATA22H3/ MATA23H3/ MAT223H5/ MAT240H5/ MATB24H3/ MAT224H5
STA414H1,Statistical Methods for Machine Learning II,"(3, 'Winter')!!",(STA314H1/CSC411H1(unaccounted)/CSC311H1);STA302H1,,CSC412H1,,Winter!!,"STA314H1/ CSC411H1/ CSC311H1/ (STA314H5, STA315H5)/ CSCC11H3/ CSC411H5; STA302H1/ STAC67H3/ STA302H5; CSC108H1/ CSC110Y1/ CSC120H1/ CSC148H1/ CSCA08H3/ CSCA48H3/ CSCA20H3/ CSC108H5/ CSC148H5; MAT235Y1/ MAT237Y1/ MAT257Y1/ (MATB41H3, MATB42H3)/ (MAT232H5, MAT236H5)/ (MAT233H5, MAT236H5); MAT223H1/ MAT224H1/ MAT240H1/ MATA22H3/ MATA23H3/ MAT223H5/ MAT240H5/ MATB24H3/ MAT224H5"
STA437H1,Methods for Multivariate Data,"(3, 'Winter')",STA302H1,,,,"Fall,Winter",STA302H1/STAC67H3/STA302H5
STA442H1,Methods of Applied Statistics,"(4, 'Fall')",STA303H1,,,,Fall,"STA303H1/(STAC67H3, STAC51H3); CSC108H1/CSC110Y1/CSC120H1/CSC148H1/CSCA08H3/CSCA48H3/CSCA20H3/CSC108H5/CSC148H5"
STA447H1,Stochastic Processes,"(3, 'Winter')",STA347H1/MAT377H1,,,,Winter,STA347H1/MAT377H1/STAC62H3
STA450H1,Topics in Statistics,"(1, 'Winter')",,,,Prereq: 9.0 credits,Winter,9.0 credits
STA452H1,Mathematical Statistics I,"(4, 'Fall')",((STA257H1;STA355H1)/STA347H1),,,"('', '.')",Fall,"MAT223H1/ MAT224H1/ MAT240H1/ MATA22H3/ MATA23H3/ MAT223H5/ MAT240H5/ MATB24H3/ MAT224H5; MAT235Y1/ MAT237Y1/ MAT257Y1/ (MATB41H3, MATB42H3)/ (MAT232H5, MAT236H5)/ (MAT233H5, MAT236H5); (STA257H1, STA355H1)/ STA347H1. (Note: MAT237Y1/ MAT257Y1; (MAT223H1, MAT224H1)/ MAT240H1 very strongly recommended.)"
STA453H1,Mathematical Statistics II,"(4, 'Winter')",STA452H1,,,,Winter,STA452H1
STA457H1,Time Series Analysis,"(3, 'Winter')",STA302H1,,,,"Fall!!,Winter","STA302H1/STAC67H3/STA302H5; MAT235Y1/MAT237Y1/MAT257Y1/(MATB41H3, MATB42H3)/(MAT232H5, MAT236H5)/(MAT233H5, MAT236H5)"
STA465H1,Spatial Data Analysis,"(4, 'Fall')",STA302H1;STA303H1,,,,Fall,"STA302H1/STAC67H3/STA302H5, STA303H1"
STA475H1,Survival Analysis,"(4, 'Fall')",,STA303H1,,,Fall,
STA480H1,Fundamentals of Statistical Genetics,"(4, 'Fall')",STA303H1,,,,Fall,STA303H1
STA490Y1,"Statistical Consultation, Communication, and Collaboration","(4, 'Fall-Winter')",STA303H1;(STA304H1/STA305H1),STA355H1,,"Uncleanable string: ""STA355H1; one additional 400-level STA course""",Fall-Winter,"STA303H1, STA304H1/ STA305H1"
STA492H1,Seminar in Statistical Science,"(3, 'Winter')",STA355H1,,,(Permission of instructor. An application is required to be considered for this course. Information about this special enrolment course as well as a link to the online application form is available on the Department of Statistical Sciences website. Priority will be given to students who complete the application during the priority enrolment period the summer before the course is offered and who are completing all requirements of the Specialist in Statistical Science: Theory and Methods or the Statistics Specialist that academic year.),Winter,STA355H1 (Permission of instructor. An application is required to be considered for this course. Information about this special enrolment course as well as a link to the online application form is available on the Department of Statistical Sciences website. Priority will be given to students who complete the application during the priority enrolment period the summer before the course is offered and who are completing all requirements of the Specialist in Statistical Science: Theory and Methods or the Statistics Specialist that academic year.)
STA496H1,Readings in Statistics,"(1, 'Winter')",,,"STA497H1,STA498Y1,STA499Y1","Uncleanable string: ""At least 1.0 STA credit at the 300+ level with a minimum grade of 80% in each course""","Fall,Winter,Fall-Winter",At least 1.0 STA credit at the 300+ level with a minimum grade of 80% in each course
STA497H1,Readings in Statistics,"(1, 'Winter')",,,"STA496H1,STA498Y1,STA499Y1","Uncleanable string: ""At least 1.0 STA credit at the 300+ level with a minimum grade of 80% in each course""","Fall,Winter,Fall-Winter",At least 1.0 STA credit at the 300+ level with a minimum grade of 80% in each course
ACT199H1,Decipher Financial Puzzles in the Media and Pop Culture,"(2, 'Fall')!!",,,,,Fall!!,
ACT230H1,Mathematics of Finance for Non-Actuaries,"(2, 'Fall')",,,ACT240H1,"Uncleanable string: ""First-year Calculus""",Fall,First-year Calculus
ACT240H1,Mathematics of Investment & Credit,"(2, 'Fall')",,,ACT230H1,,Fall,MAT137Y1 (minimum grade 63%)/MAT157Y1 (minimum grade 60%)
ACT245H1,Financial Principles for Actuarial Science I,"(2, 'Winter')",ACT240H1,,,,Winter,"ACT240H1, MAT137Y1 (minimum grade 63%)/MAT157Y1 (minimum grade 60%)"
ACT247H1,Introductory Life Contingencies,"(2, 'Winter')",ACT240H1;STA257H1,,,,Winter,ACT240H1; MAT137Y1 (minimum grade 63%)/MAT157Y1 (minimum grade 60%); STA257H1
ACT348H1,Life Contingencies II,"(3, 'Fall')",ACT240H1;ACT245H1;ACT247H1,(STA257H1/STA237H1),,,Fall,"ACT240H1 (minimum 63%), ACT245H1 (minimum 63%), ACT247H1 (minimum 63%)"
ACT349H1,Corporate Finance for Actuarial Science,"(3, 'Fall')",ACT240H1;ACT245H1;ACT247H1,(STA257H1/STA237H1),"ECO358H1,ECO359H1,RSM332H1,RSM333H1",,Fall,"ACT240H1 (minimum 63%), ACT245H1 (minimum 63%), ACT247H1 (minimum 63%)"
ACT350H1,Applied Probability for Actuarial Science,"(3, 'Fall')",ACT240H1;ACT245H1;ACT247H1;(STA257H1/STA237H1),,,,Fall,"ACT240H1 (minimum 63%), ACT245H1 (minimum 63%), ACT247H1 (minimum 63%), STA257H1/ STA237H1"
ACT370H1,Financial Principles for Actuarial Science II,"(3, 'Winter')",ACT240H1;ACT245H1;ACT247H1,(STA261H1/STA238H1),RSM435H1,,Winter,"ACT240H1 (minimum 63%), ACT245H1 (minimum 63%), ACT247H1 (minimum 63%)"
ACT371H1,Basic Reserving Methods For P&C Insurance,"(3, 'Fall')!!",ACT240H1;(STA257H1/STA237H1),,,,Fall!!,"ACT240H1, STA257H1/ STA237H1"
ACT372H1,Basic Ratemaking Methods For P&C Insurance,"(3, 'Winter')",ACT371H1,,,,Winter,ACT371H1
